{
  "$schema": "https://json-schema.org/draft/2020-12/schema",
  "title": "X4-R0 DHCP, DNS, and Service Security Design and Runtime Gate v1",
  "type": "object",
  "additionalProperties": false,
  "required": ["schema_version", "gate_id", "status", "track", "source_boundary", "compatibility", "source_bindings", "topology_design", "baseline_signature", "dhcp_dns_service_security_scope", "feature_boundary", "release_sequence", "safety_invariants", "evidence_policy", "acceptance", "claim_boundary", "runtime_authorization"],
  "properties": {
    "schema_version": {"const": 1},
    "gate_id": {"const": "x4_r0_dhcp_dns_service_security_design_runtime_gate_v1"},
    "status": {"const": "ACCEPTED_DESIGN_ONLY"},
    "track": {"$ref": "#/$defs/track"},
    "source_boundary": {"$ref": "#/$defs/sourceBoundary"},
    "compatibility": {"$ref": "#/$defs/compatibility"},
    "source_bindings": {"type": "array", "minItems": 11, "maxItems": 11, "items": {"$ref": "#/$defs/sourceBinding"}},
    "topology_design": {"$ref": "#/$defs/topology"},
    "baseline_signature": {"$ref": "#/$defs/signature"},
    "dhcp_dns_service_security_scope": {"type": "array", "minItems": 5, "maxItems": 5, "items": {"$ref": "#/$defs/faultSlice"}},
    "feature_boundary": {"$ref": "#/$defs/featureBoundary"},
    "release_sequence": {"type": "array", "minItems": 7, "maxItems": 7, "items": {"$ref": "#/$defs/release"}},
    "safety_invariants": {"type": "array", "minItems": 10, "maxItems": 10, "uniqueItems": true, "items": {"$ref": "#/$defs/upperIdentifier"}},
    "evidence_policy": {"$ref": "#/$defs/evidencePolicy"},
    "acceptance": {"$ref": "#/$defs/acceptance"},
    "claim_boundary": {"$ref": "#/$defs/claimBoundary"},
    "runtime_authorization": {"$ref": "#/$defs/runtimeAuthorization"}
  },
  "$defs": {
    "lowerIdentifier": {"type": "string", "pattern": "^[a-z][a-z0-9_]*$"},
    "upperIdentifier": {"type": "string", "pattern": "^[A-Z][A-Z0-9_]*$"},
    "sha256": {"type": "string", "pattern": "^[0-9a-f]{64}$"},
    "track": {"type": "object", "additionalProperties": false, "required": ["parent_gate", "phase9_status", "current_release", "next_release"], "properties": {"parent_gate": {"const": "x3_r5_layer2_vlan_closeout_v1"}, "phase9_status": {"const": "P9_R1_PAUSED_BY_USER"}, "current_release": {"const": "X4_R0_DHCP_DNS_SERVICE_SECURITY_DESIGN_GATE"}, "next_release": {"const": "X4_R1_DHCP_SERVER_UNAVAILABLE"}}},
    "sourceBoundary": {"type": "object", "additionalProperties": false, "required": ["parent_commit", "extension_policy", "runtime_inherited"], "properties": {"parent_commit": {"const": "2a763c6c6cd44f984ce08331e20d3e03445a0037"}, "extension_policy": {"const": "APPEND_ONLY"}, "runtime_inherited": {"const": false}}},
    "compatibility": {"type": "object", "additionalProperties": false, "required": ["frozen_baseline_mutation_allowed", "accepted_x2_mutation_allowed", "accepted_x3_mutation_allowed", "accepted_result_mutation_allowed", "api_v1_status", "future_extended_api", "truth_model"], "properties": {"frozen_baseline_mutation_allowed": {"const": false}, "accepted_x2_mutation_allowed": {"const": false}, "accepted_x3_mutation_allowed": {"const": false}, "accepted_result_mutation_allowed": {"const": false}, "api_v1_status": {"const": "FROZEN_BASELINE"}, "future_extended_api": {"const": "/api/v2"}, "truth_model": {"const": "SINGLE_FAULT_ONLY"}}},
    "sourceBinding": {"type": "object", "additionalProperties": false, "required": ["binding_id", "path", "sha256"], "properties": {"binding_id": {"$ref": "#/$defs/lowerIdentifier"}, "path": {"type": "string", "minLength": 1, "pattern": "^(?!/)(?!.*(?:^|/)\\.\\.(?:/|$)).+$"}, "sha256": {"$ref": "#/$defs/sha256"}}},
    "topology": {"type": "object", "additionalProperties": false, "required": ["context_path", "topology_id", "status", "switch_plane", "container_image", "node_count", "link_count", "service_network", "flow_roles", "required_raw_observations"], "properties": {"context_path": {"const": "labs/topologies/x4_r1_dhcp_dns_service/topology_context_v1.json"}, "topology_id": {"const": "X4_TOP_01_DHCP_DNS_SERVICE_SECURITY"}, "status": {"const": "DESIGN_ONLY"}, "switch_plane": {"const": "LINUX_BRIDGE_SERVICE_SEGMENT"}, "container_image": {"const": "ind-linux:0.1"}, "node_count": {"const": 6}, "link_count": {"const": 5}, "service_network": {"const": "10.40.0.0/24"}, "flow_roles": {"type": "array", "minItems": 3, "maxItems": 3, "items": {"$ref": "#/$defs/flowRole"}}, "required_raw_observations": {"type": "array", "minItems": 7, "uniqueItems": true, "items": {"$ref": "#/$defs/upperIdentifier"}}}},
    "flowRole": {"type": "object", "additionalProperties": false, "required": ["flow_id", "source", "destination", "transport", "port", "classification_role"], "properties": {"flow_id": {"$ref": "#/$defs/lowerIdentifier"}, "source": {"$ref": "#/$defs/lowerIdentifier"}, "destination": {"$ref": "#/$defs/lowerIdentifier"}, "transport": {"enum": ["UDP", "TCP"]}, "port": {"type": "integer", "minimum": 1, "maximum": 65535}, "classification_role": {"enum": ["DHCP_EXCHANGE", "DNS_QUERY", "SERVICE_FLOW"]}}},
    "signature": {"type": "object", "additionalProperties": false, "required": ["dhcp_server_reachable", "dhcp_lease_obtained", "dhcp_lease_matches_expected_scope", "dns_server_reachable", "dns_query_succeeds", "dns_answer_matches_expected", "service_process_running", "service_port_reachable", "service_flow_blocked_by_policy"], "properties": {"dhcp_server_reachable": {"type": "boolean"}, "dhcp_lease_obtained": {"type": "boolean"}, "dhcp_lease_matches_expected_scope": {"type": "boolean"}, "dns_server_reachable": {"type": "boolean"}, "dns_query_succeeds": {"type": "boolean"}, "dns_answer_matches_expected": {"type": "boolean"}, "service_process_running": {"type": "boolean"}, "service_port_reachable": {"type": "boolean"}, "service_flow_blocked_by_policy": {"type": "boolean"}}},
    "faultSlice": {"type": "object", "additionalProperties": false, "required": ["order", "fault_code", "fault_type", "category", "implementation_release", "planned_rule_id", "injector_mechanism", "restoration_mechanism", "required_feature_ids", "fault_signature", "required_evidence_modes", "excluded_confounders", "recovery_intent_required", "idempotent_restoration_required", "real_e2e_required"], "properties": {"order": {"type": "integer", "minimum": 1, "maximum": 5}, "fault_code": {"enum": ["D1", "D2", "D3", "D4", "E2"]}, "fault_type": {"$ref": "#/$defs/lowerIdentifier"}, "category": {"enum": ["services", "security"]}, "implementation_release": {"$ref": "#/$defs/upperIdentifier"}, "planned_rule_id": {"$ref": "#/$defs/upperIdentifier"}, "injector_mechanism": {"$ref": "#/$defs/lowerIdentifier"}, "restoration_mechanism": {"$ref": "#/$defs/lowerIdentifier"}, "required_feature_ids": {"type": "array", "minItems": 9, "maxItems": 9, "uniqueItems": true, "items": {"$ref": "#/$defs/lowerIdentifier"}}, "fault_signature": {"$ref": "#/$defs/signature"}, "required_evidence_modes": {"type": "array", "minItems": 4, "uniqueItems": true, "items": {"$ref": "#/$defs/upperIdentifier"}}, "excluded_confounders": {"type": "array", "minItems": 4, "uniqueItems": true, "items": {"$ref": "#/$defs/lowerIdentifier"}}, "recovery_intent_required": {"const": true}, "idempotent_restoration_required": {"const": true}, "real_e2e_required": {"const": true}}},
    "featureBoundary": {"type": "object", "additionalProperties": false, "required": ["catalog_id", "required_feature_ids", "collector_bindings"], "properties": {"catalog_id": {"const": "x1_feature_catalog_v1"}, "required_feature_ids": {"type": "array", "minItems": 9, "maxItems": 9, "uniqueItems": true, "items": {"$ref": "#/$defs/lowerIdentifier"}}, "collector_bindings": {"type": "array", "minItems": 2, "maxItems": 2, "items": {"type": "object", "additionalProperties": false, "required": ["collector_id", "collector_version", "collector_status", "feature_ids"], "properties": {"collector_id": {"$ref": "#/$defs/lowerIdentifier"}, "collector_version": {"const": 1}, "collector_status": {"const": "DESIGN_ONLY"}, "feature_ids": {"type": "array", "minItems": 1, "uniqueItems": true, "items": {"$ref": "#/$defs/lowerIdentifier"}}}}}}},
    "release": {"type": "object", "additionalProperties": false, "required": ["release_id", "objective", "status", "runtime_inherited"], "properties": {"release_id": {"$ref": "#/$defs/upperIdentifier"}, "objective": {"type": "string", "minLength": 1}, "status": {"enum": ["ACCEPTED_DESIGN_ONLY", "PLANNED"]}, "runtime_inherited": {"const": false}}},
    "evidencePolicy": {"type": "object", "additionalProperties": false, "required": ["evidence_contract", "raw_artifact_hash_required", "collector_provenance_required", "real_evidence_required_per_runtime_slice", "effectiveness_only_evidence_not_classifier", "r0_creates_empirical_evidence", "accepted_x3_evidence_read_only", "report_only_test_access_allowed"], "properties": {"evidence_contract": {"const": "Evidence v4"}, "raw_artifact_hash_required": {"const": true}, "collector_provenance_required": {"const": true}, "real_evidence_required_per_runtime_slice": {"const": true}, "effectiveness_only_evidence_not_classifier": {"const": true}, "r0_creates_empirical_evidence": {"const": false}, "accepted_x3_evidence_read_only": {"const": true}, "report_only_test_access_allowed": {"const": false}}},
    "acceptance": {"type": "object", "additionalProperties": false, "required": ["new_runtime_executed", "new_empirical_claim_created", "topology_context_validated", "unit_tests_required", "integration_tests_required", "infrastructure_e2e_required_for_r0", "existing_infrastructure_regression_required", "frozen_artifacts_unchanged", "explicit_gate_before_each_runtime_release"], "properties": {"new_runtime_executed": {"const": false}, "new_empirical_claim_created": {"const": false}, "topology_context_validated": {"const": true}, "unit_tests_required": {"const": true}, "integration_tests_required": {"const": true}, "infrastructure_e2e_required_for_r0": {"const": false}, "existing_infrastructure_regression_required": {"const": true}, "frozen_artifacts_unchanged": {"const": true}, "explicit_gate_before_each_runtime_release": {"const": true}}},
    "claimBoundary": {"type": "object", "additionalProperties": false, "required": ["proves", "does_not_prove"], "properties": {"proves": {"type": "array", "minItems": 4, "uniqueItems": true, "items": {"type": "string", "minLength": 1}}, "does_not_prove": {"type": "array", "minItems": 8, "uniqueItems": true, "items": {"type": "string", "minLength": 1}}}},
    "runtimeAuthorization": {"type": "object", "additionalProperties": false, "required": ["containerlab_execution", "network_mutation", "new_evidence_collection", "dataset_generation", "model_fit_or_selection", "estimator_deserialization", "method_prediction", "metric_calculation", "report_only_test_access", "multiple_fault_execution"], "properties": {"containerlab_execution": {"const": false}, "network_mutation": {"const": false}, "new_evidence_collection": {"const": false}, "dataset_generation": {"const": false}, "model_fit_or_selection": {"const": false}, "estimator_deserialization": {"const": false}, "method_prediction": {"const": false}, "metric_calculation": {"const": false}, "report_only_test_access": {"const": false}, "multiple_fault_execution": {"const": false}}}
  }
}
