{
  "schema_version": 1,
  "gate_id": "x4_r0_dhcp_dns_service_security_design_runtime_gate_v1",
  "status": "ACCEPTED_DESIGN_ONLY",
  "track": {"parent_gate": "x3_r5_layer2_vlan_closeout_v1", "phase9_status": "P9_R1_PAUSED_BY_USER", "current_release": "X4_R0_DHCP_DNS_SERVICE_SECURITY_DESIGN_GATE", "next_release": "X4_R1_DHCP_SERVER_UNAVAILABLE"},
  "source_boundary": {"parent_commit": "2a763c6c6cd44f984ce08331e20d3e03445a0037", "extension_policy": "APPEND_ONLY", "runtime_inherited": false},
  "compatibility": {"frozen_baseline_mutation_allowed": false, "accepted_x2_mutation_allowed": false, "accepted_x3_mutation_allowed": false, "accepted_result_mutation_allowed": false, "api_v1_status": "FROZEN_BASELINE", "future_extended_api": "/api/v2", "truth_model": "SINGLE_FAULT_ONLY"},
  "source_bindings": [
    {"binding_id": "x0_scope_gate", "path": "plans/expansion/X0_SCOPE_COMPATIBILITY_FREEZE_V1.json", "sha256": "99d80b1abc15c2994e41d8d4dd650e88ea235313d7f2461276d33c44f913e33b"},
    {"binding_id": "x1_contract_gate", "path": "plans/expansion/X1_EXTENDED_CONTRACTS_MODULAR_COLLECTION_V1.json", "sha256": "934e6c52e42e0d1f48b04611b502373252ce3c99041ebd750d387c99e1fe85ec"},
    {"binding_id": "x1_feature_catalog", "path": "plans/expansion/X1_FEATURE_CATALOG_V1.json", "sha256": "3dba72e83d7e17767ab0851a24541aa7d2d8b789dcf04a5aeb726ff48e9518e4"},
    {"binding_id": "x1_evidence_mask_plan", "path": "plans/expansion/X1_EVIDENCE_MASK_PLAN_V2.json", "sha256": "29e4df034936d34165dcd22e86bbc0cae54301f48139ef62ecbd0ce4f0485c22"},
    {"binding_id": "topology_context_schema", "path": "schemas/topology_context_v1.schema.json", "sha256": "aa47595f5d112eb86eeee07e8fd8dd82f6ea660c7d6a5452faa93a156dd9028e"},
    {"binding_id": "evidence_v4_schema", "path": "schemas/evidence_v4.schema.json", "sha256": "dcc61966246a03a03d060714a67b5cf14aa48f6925c262c267d07408b77f8315"},
    {"binding_id": "modular_collector_registry", "path": "src/collection/modular_registry.py", "sha256": "4dbec2f96d7cc64eb96c5aee19bef99c8bd55c17623401ba531661256ae321fd"},
    {"binding_id": "x1_gate_implementation", "path": "src/expansion/x1_gate.py", "sha256": "5c5f4a686c5846627b7baef623b2a910e9e48f549d003c988fc0d4b0b3865fed"},
    {"binding_id": "x3_r5_closeout_plan", "path": "plans/expansion/X3_R5_LAYER2_VLAN_CLOSEOUT_V1.json", "sha256": "63b309230aedbda2e44626ec937a367610187f6f16f2324985e59757694d911a"},
    {"binding_id": "x3_r5_evidence_receipt", "path": "plans/expansion/X3_R5_LAYER2_VLAN_EVIDENCE_RECEIPT_V1.json", "sha256": "b7d1fe29607638375b5ca59b5469d40e90a02d81c9e763bb5539c820a1998328"},
    {"binding_id": "x3_r5_gate_implementation", "path": "src/expansion/x3_r5_gate.py", "sha256": "a140ea68d83d8808beb88024ca64e21277849f09a4302b6bfec29c1e4a88cf63"}
  ],
  "topology_design": {
    "context_path": "labs/topologies/x4_r1_dhcp_dns_service/topology_context_v1.json",
    "topology_id": "X4_TOP_01_DHCP_DNS_SERVICE_SECURITY",
    "status": "DESIGN_ONLY",
    "switch_plane": "LINUX_BRIDGE_SERVICE_SEGMENT",
    "container_image": "ind-linux:0.1",
    "node_count": 6,
    "link_count": 5,
    "service_network": "10.40.0.0/24",
    "flow_roles": [
      {"flow_id": "dhcp_lease_flow", "source": "client", "destination": "dhcp_server", "transport": "UDP", "port": 67, "classification_role": "DHCP_EXCHANGE"},
      {"flow_id": "dns_query_flow", "source": "client", "destination": "dns_server", "transport": "UDP", "port": 53, "classification_role": "DNS_QUERY"},
      {"flow_id": "service_tcp_flow", "source": "client", "destination": "app_server", "transport": "TCP", "port": 8080, "classification_role": "SERVICE_FLOW"}
    ],
    "required_raw_observations": ["DHCP_SERVER_ENDPOINT_PROBE", "DHCP_LEASE_EXCHANGE", "DHCP_LEASE_SCOPE_INSPECTION", "DNS_SERVER_NETWORK_PROBE", "DNS_PROCESS_STATE", "DNS_QUERY_AND_ANSWER", "SERVICE_PROCESS_STATE", "SERVICE_PORT_PROBE", "SERVICE_POLICY_INSPECTION", "GENERIC_CONNECTIVITY_CONTROL"]
  },
  "baseline_signature": {"dhcp_server_reachable": true, "dhcp_lease_obtained": true, "dhcp_lease_matches_expected_scope": true, "dns_server_reachable": true, "dns_query_succeeds": true, "dns_answer_matches_expected": true, "service_process_running": true, "service_port_reachable": true, "service_flow_blocked_by_policy": false},
  "dhcp_dns_service_security_scope": [
    {"order": 1, "fault_code": "D1", "fault_type": "dhcp_server_unavailable", "category": "services", "implementation_release": "X4_R1_DHCP_SERVER_UNAVAILABLE", "planned_rule_id": "R_X4_SERVICE_SECURITY_001", "injector_mechanism": "stop_dhcp_service_on_dhcp_server_only", "restoration_mechanism": "restore_exact_dhcp_service_state_and_scope", "required_feature_ids": ["dhcp_server_reachable", "dhcp_lease_obtained", "dhcp_lease_matches_expected_scope", "dns_server_reachable", "dns_query_succeeds", "dns_answer_matches_expected", "service_process_running", "service_port_reachable", "service_flow_blocked_by_policy"], "fault_signature": {"dhcp_server_reachable": false, "dhcp_lease_obtained": false, "dhcp_lease_matches_expected_scope": false, "dns_server_reachable": true, "dns_query_succeeds": true, "dns_answer_matches_expected": true, "service_process_running": true, "service_port_reachable": true, "service_flow_blocked_by_policy": false}, "required_evidence_modes": ["DHCP_SERVER_ENDPOINT_PROBE", "DHCP_LEASE_EXCHANGE", "DHCP_LEASE_SCOPE_INSPECTION", "DNS_QUERY_AND_ANSWER"], "excluded_confounders": ["dhcp_pool_misconfiguration", "dns_service_down", "wrong_dns_record", "firewall_service_block"], "recovery_intent_required": true, "idempotent_restoration_required": true, "real_e2e_required": true},
    {"order": 2, "fault_code": "D2", "fault_type": "dhcp_pool_misconfiguration", "category": "services", "implementation_release": "X4_R2_DHCP_POOL_MISCONFIGURATION", "planned_rule_id": "R_X4_SERVICE_SECURITY_002", "injector_mechanism": "replace_expected_dhcp_scope_with_controlled_empty_pool", "restoration_mechanism": "restore_exact_dhcp_scope_and_lease_database", "required_feature_ids": ["dhcp_server_reachable", "dhcp_lease_obtained", "dhcp_lease_matches_expected_scope", "dns_server_reachable", "dns_query_succeeds", "dns_answer_matches_expected", "service_process_running", "service_port_reachable", "service_flow_blocked_by_policy"], "fault_signature": {"dhcp_server_reachable": true, "dhcp_lease_obtained": false, "dhcp_lease_matches_expected_scope": false, "dns_server_reachable": true, "dns_query_succeeds": true, "dns_answer_matches_expected": true, "service_process_running": true, "service_port_reachable": true, "service_flow_blocked_by_policy": false}, "required_evidence_modes": ["DHCP_SERVER_ENDPOINT_PROBE", "DHCP_LEASE_EXCHANGE", "DHCP_LEASE_SCOPE_INSPECTION", "DNS_QUERY_AND_ANSWER"], "excluded_confounders": ["dhcp_server_unavailable", "dns_service_down", "wrong_dns_record", "firewall_service_block"], "recovery_intent_required": true, "idempotent_restoration_required": true, "real_e2e_required": true},
    {"order": 3, "fault_code": "D3", "fault_type": "dns_service_down", "category": "services", "implementation_release": "X4_R3_DNS_SERVICE_DOWN", "planned_rule_id": "R_X4_SERVICE_SECURITY_003", "injector_mechanism": "stop_dns_service_on_dns_server_only", "restoration_mechanism": "restore_exact_dns_process_and_zone_state", "required_feature_ids": ["dhcp_server_reachable", "dhcp_lease_obtained", "dhcp_lease_matches_expected_scope", "dns_server_reachable", "dns_query_succeeds", "dns_answer_matches_expected", "service_process_running", "service_port_reachable", "service_flow_blocked_by_policy"], "fault_signature": {"dhcp_server_reachable": true, "dhcp_lease_obtained": true, "dhcp_lease_matches_expected_scope": true, "dns_server_reachable": true, "dns_query_succeeds": false, "dns_answer_matches_expected": false, "service_process_running": false, "service_port_reachable": false, "service_flow_blocked_by_policy": false}, "required_evidence_modes": ["DNS_SERVER_NETWORK_PROBE", "DNS_PROCESS_STATE", "SERVICE_PORT_PROBE", "DNS_QUERY_AND_ANSWER"], "excluded_confounders": ["dhcp_server_unavailable", "dhcp_pool_misconfiguration", "wrong_dns_record", "firewall_service_block"], "recovery_intent_required": true, "idempotent_restoration_required": true, "real_e2e_required": true},
    {"order": 4, "fault_code": "D4", "fault_type": "wrong_dns_record", "category": "services", "implementation_release": "X4_R4_WRONG_DNS_RECORD", "planned_rule_id": "R_X4_SERVICE_SECURITY_004", "injector_mechanism": "replace_expected_dns_record_with_controlled_wrong_answer", "restoration_mechanism": "restore_exact_dns_zone_record_and_service_state", "required_feature_ids": ["dhcp_server_reachable", "dhcp_lease_obtained", "dhcp_lease_matches_expected_scope", "dns_server_reachable", "dns_query_succeeds", "dns_answer_matches_expected", "service_process_running", "service_port_reachable", "service_flow_blocked_by_policy"], "fault_signature": {"dhcp_server_reachable": true, "dhcp_lease_obtained": true, "dhcp_lease_matches_expected_scope": true, "dns_server_reachable": true, "dns_query_succeeds": true, "dns_answer_matches_expected": false, "service_process_running": true, "service_port_reachable": true, "service_flow_blocked_by_policy": false}, "required_evidence_modes": ["DNS_SERVER_NETWORK_PROBE", "DNS_PROCESS_STATE", "SERVICE_PORT_PROBE", "DNS_QUERY_AND_ANSWER"], "excluded_confounders": ["dhcp_server_unavailable", "dhcp_pool_misconfiguration", "dns_service_down", "firewall_service_block"], "recovery_intent_required": true, "idempotent_restoration_required": true, "real_e2e_required": true},